{
  "version": "1.0",
  "kind": "parameter_template",
  "id": "template_default_ipv4",
  "source": "system",
  "timestamps": {
    "created_at": "2026-05-04T10:00:00Z",
    "updated_at": "2026-05-04T10:00:00Z"
  },
  "meta": {
    "definition_id": "cfst_master_config"
  },
  "payload": {
    "template_name": "默认 IPv4 优选模板",
    "parameter_values": {
      "thread_count": { "enabled": true, "value": 200 },
      "upload_speed": { "enabled": true, "value": 50 },
      "test_count": { "enabled": true, "value": 4 },
      "use_json": { "enabled": true, "value": true }
    }
  }
}
