{
  "version": "1.0",
  "kind": "task_run",
  "id": "task_20260504_0001",
  "source": "web_console",
  "timestamps": {
    "created_at": "2026-05-04T10:00:00Z",
    "updated_at": "2026-05-04T10:10:00Z"
  },
  "meta": {},
  "payload": {
    "status": "success",
    "trigger_source": "manual",
    "pid": 12345,
    "started_at": "2026-05-04T10:00:00Z",
    "finished_at": "2026-05-04T10:10:00Z",
    "stdout_path": "logs/task_20260504_0001.stdout.log",
    "stderr_path": "logs/task_20260504_0001.stderr.log",
    "result_path": "data/results/task_20260504_0001.json",
    "parameter_snapshot": {
      "thread_count": { "enabled": true, "value": 200 },
      "upload_speed": { "enabled": true, "value": 50 },
      "test_count": { "enabled": true, "value": 4 },
      "use_json": { "enabled": true, "value": true }
    }
  }
}
